number,control,description
103,0,She is happy with her life and takes much pride in being a good mother of three children. She still makes time to hang out with her friends to keep the other side of her life happy.
104,0,Maria seems very content with her chosen life of raising her children.  She enjoys being a mother and still keeps in touch with her old friends so she isn't completely consumed by her children.
105,0,I believe she is feeling the impact of being a mother to her children. She enjoys taking care of her children and making them happy. This is a biological response that occurs with a majority of mothers.
106,1,I think Maria is so busy that she doesn't really have time to sit down and think about her emotions. I think if she slowed down; she might realize that that she is using this busyness to prevent her from coming to terms with the possibility that she may be substituting her goals and ambitions for that of her children.
107,1,She is usually thinking about her children and other people; not about herself. They distract her so that she never focuses on the things that get her down; and she is constantly thinking of the next thing she needs to do -- logistics of how to get her kids places; what her friends want to do that night; etc.
108,0,She is very happy and satisfied. She feels she has made good decisions that have led her to being happy with her life; and happy with what life has given her. She lives her life for others; and is totally fine with that. 
109,1,I think that Maria is thinking that her children are the greatest thing to ever happen to her. She is probably thinking that she would do anything for her children and that her purpose in life is to raise her children well.
110,1,I think she feels very compelled to do everything for her children without ever really thinking about what she might do just for herself. She's thinking of the next thing on the list that she has to achieve; where she has to be; who  she has to see; what she has to cook; etc. while never considering doing anything else.
111,0,Maria feels that having her children gives her a reason to live. Making her children happy and giving them a good; fulfilling life in turn makes Maria feel fulfilled and like her life has purpose. For her; love and family equal a positive; happy life.
112,0,Maria is just happy to be creating a path for success for her children. She is acting extremely selfless in that she is only worried about her children. She subconsciously understands that her children are the most important thing in the world; and in the end she will remember helping her children over spending time with her friends.
113,0,Maris seems to be happy. But it seems that there is something missing in this story(it was not provided the rest). She has a very busy life for she has to take care of the children.
114,0,"Maria's mind is focused on the positives of life.  she has chosen to live in such a way; that she spends so much time and thoughts about the great things in her life; that the can easily handle the bad things when they happen.  this is a classic example of ""positive thinking."""
115,0,Her kids are always on her mind; because of this; she feels fulfilled in life and is anxious to live another day.  Her family is her number one priority and her happiness demonstrates that.
116,0,Maria sounds like she is a single mother; but one who lives for her children; and that is all she needs in life. Maria thinks everyday what she could do to make her children's lives better-off; and in return this makes her and her children happy. Maria thinks about her children 34 7  365.
117,0,She is not unhappy and she loves to care for her children.  She likes to keep busy and has tons of things to do with her children and her children's friends.  She has a lot to look forward to.
118,1,Maria feels fulfilled with her life. She has children who she loves and who love her in return; and she is extremely dedicated to them. She enjoys spending time with them and doing things to help make their lives better. 
119,1,Maria loves her children. Her benevolence provides fulfillment; which could be her selflessness. Or; she was treated poorly or has seen people be treated poorly in the past; and seeks to rectify this by caring about the people around her.
120,1,Maria probably had the mindset from a young age that she wanted to have children. By having children and maintaining her previous lifestyle and seeing her friends she is able to be pleased with her life choices.
121,0,maria enjoys making her children happy - this; in turn; makes her happy. she also visits her own friends when she can; which brings her joy. the focus of her life is family and friends; and she is able to spend so much time with the most important people in her life.
122,1,To be honest I do not have any specific guess regarding Maria's decision making so I do not know what to think. If anything I think that Maria is going to stay focused and do what she needs to in order to successfully move forward. I also do not recall very many details from the past couple excerpts because I did not ready very much into them. My goal in this position is simply to meet the remainder of the character requirement. I will admit I did not read in anticipation of such a specific quiz. Also; I do not believe that believe that one hundred and seventy five characters in in any way; near two sentences. This in my opinion is a large requirement on behalf of the individual completing this survey. If I were to guess I would say that Maria is a very cautious individual and hopefully be able to accomplish all of her goals given the parameters of this event in particular. Again this was a very straining requirement for such a small survey. 
123,0,Maria is happy because she has the support of her family. When people are alienated from their family bad things happen. This family cohesiveness creates positive experiences. 
124,1,Maria is probably thinking about her children's futures and what will become of them. Maria is also probably trying to keep track of all the things needs to complete during her day and week. She stays very busy and has many tasks at hand that are important to her and her family.
125,0,I think Maria is feeling a lot of fulfillment; having raised her children to this point and seeing them thriving.  She gets satisfaction from the peace and joy of spending time with her children and her old friends.
126,1,"Maria is someone who thinks that the glass as half full rather than half empty.  Maria is thinking ""Why be one of those people who is so miserable and inappreciative that I see right in front of me that I have wonderful children and they have wonderful friends.  This is a time I will never get back; so why not dive in; take them to the park; be involved at their school and in their lives in general."""
127,1,I think that she enjoys motherhood very much. She seems to be enjoying all the simple things in life that many other people would take for granted. She loves her simple life very much.
128,1,She is planning out the children's present and future.  Maria's world is full of children; friends and love.  There is no negativity in Maria's mind.  Everyone has a place and belongs in Maria's life.  I feel this is what is going on in her mind.
129,1,Although it may feel like a lot of work to her. In Maria's thoughts; she is quite content because her children are the focus to her emotions. All the actions she does is for her children and the way she expresses; really relflects on what she does.
130,0,Because Maria loves her children so much; it makes her feel good to do things for them and to take care of them.  This makes her feel good because she cares about whether they are happy and about whether they have a good future.  Since these goals are important to her; then it fulfills her and makes her happy to do so much for her children.
131,0,She is thinking about how lucky she is to have such great children. She is thinking about how wondergul everything turned out. Also she is thinking about how grateful she should be and is about her life.
132,1,Maria sounds like she has learned to balance her home life with her social life. It is obvious that she loves her children very much; and they love her back very much. She has managed to keep her friends close and makes time for them. Her life sounds very well rounded and very complete. She is extremely lucky and definitely has her priorities straight.
133,0,About her children's futures and what she can do to insure they end up having happy lives. She also goes over how truly grateful she is to be so fortunate to have three healty beautiful children.
134,1,She is wanted and needed. She finds pleasure in doing for her kids; but also finds time for old friends. Overall there is little time for anything else other than being giving and that is what she wants to do.
135,1,It's important that my children have a good life; and if they do then I am doing good in the world. But I can't get so involved in my children's lives that I neglect my friends and my needs. 
136,1,Maria is devoting her life to her children; which gives her life meaning and purpose.  She understands and is willing to do what ever she can to enrich the lives of her children.  
137,1,What is going on in Maria's mind is probably just an ease of thinking. She probably has problems just like any other indivividuals. It's just that she takes her life easily and the way she perceives things is with positivity.
138,0,There are a lot of things going on in Maria's mind with having her children. She isn't worried too about going out; as in going to the movies; parties etc. Her main thoughts are attending to her children's needs and making them happy; therefore every night is spent on that. She never feels lonely.
139,0,Maria is living a fulfilled life where are children are all that matter to her; so she gains inner peace from that thought. its something like she has inner joy which no one can take from her. she aims to please as much as possible.
140,0,I think Maria is happy but she may be in denial with the problems that come with raising children. It sounds like she may be co-dependent but that is beyond my scope. I think she does love her children and her friends but what about her. She thinks she is happy but what makes her happy about her. She spends time doing things for others but what does she do for her.. 
141,1,I think Maria is thinking mostly about her kids and not as much about herself. I think she is thinking about how much of a good parent she is and how her children will turn out well because of it. 
142,0,Maria is content with her life as she is proud of her children. She enjoys spending time with them and they fill her life with joy. When she's not with her children; she's with her friends to add an element of fun and enjoyment into her life.
143,1,Maria thinks she should take advantage now that the children are still too young to enjoy them .The children will grow up someday and things will be different ; she thinks at this point in his life should be devoted to their children and leave their personal goals for the future.
144,0,Maria is proud of the life she has created around her family and the values with which she raised her children. These factors allow her to be as content as she is and she would not change it for anything.
145,1,Maria seems to be really smart; living her life mostly to help others. she finds comfort in her children and friends. she is very optimistic about her life and she seems to love everyone around her; thus making time to meet and talk to them everyday. 
146,0,she is fulfilled and content because her family has become the most important thing in her life. her own wants and needs are secondary to her own. she has found peace in something greater than herself in providing for peoples needs outside of her own.
147,0,Maria loved her children and always want to spend time with the children. Maria never wanted to miss any small moments with the children. Maria makes sure she spends equal time for the children and her self by catching up with her friends. Maria always thinks about her children's happiness and wants to the best mother.
148,0,Maria finds taking care of her children very enjoyable. She feels happy knowing they are happy. She finds her job (as a mother) fufilling and is an optimistic person. She probably feels great joy pleasing others.
149,1,Her children mean everything to her; and doing things for them is better than doing things for herself. She also has balance which makes it nice; by keeping in touch with her old friends too.
150,0,Maria is always thinking about her children and how to provide a better life for them. She thinks about what clothes to buy; what food to cook; and what activities to plan to make sure that her children are happy.
151,1,She must be thinking about how she is getting the best of both ends of the world. She has time for friends and time for kids; which she must think is wonderful. If I had to guess her mind must be filled with how every minute she has something to do that is fullfilling in life
152,0,She must be thinking about how she is getting the best of both ends of the world. She has time for friends and time for kids; which she must think is wonderful. If I had to guess her mind must be filled with how every minute she has something to do that is fullfilling in life
153,0,I have sneaking suspicion that she is actually doinga fairly good job of deluding herself. She thinks she is happy or wants to try and stay happy for the sake of others(her children) and not herself. I may be wrong but I have hunch that when her kids grow up and leave her that she will go into a deep depression or 'empty nest' syndrome rather quickly due to the illusion of happiness no longer being reinforced in her mind by having her kids around her.
154,0,Maria is occupied with the good things in her life; she is focused on family and friends and has locked out the negative aspects outside her comfort zone. She feels joy in taking care of her kids. All in all Maria is living in a world that she has a lot of control of.
155,1,She is thinking about what is best for her children.  She is thinking about the steps to take to make a successful family.  She is thinking about balance and how to acheive it.
156,1,Maria is a busy mom; but she enjoys taking care of her children; even though it is sometimes hectic.  She seems to live in the present; appreciate what she has; and thinks about balancing her parenting activities with some personal activities.  She doesn't dwell on negative thoughts.
157,1,Maria is constantly thinking about what she needs to do next. She is continually trying to please her friends and family and make sure they are taken care of. Maria has a busy life.
158,1,Maria is thinking about how fortunate she is to have the love of her children. She thinks about friends and how she is appreciative to have them in her life.   She loves her life and feel blessed to be the person she is and have the life she does. 
159,1,Maria finds fulfillment in nurturing the growth of her children. She thinks about them primarily; but also thinks about her need for adult companionship in the form of old friends. 
160,0,Maria is focused on her children; she wishes to provide a good home and family life for them and she is doing her best to make that happen.  Her biggest fulfillment is her children and seeing them happy; she wants their future to be bright and she does what needs to be done to see tha they have what they need to move forward in life.  Maria is an excellent mother and she seems to put her own needs and wants on the backburner so her childrens needs can be dealt with ahead of anything else.  Maria is the kind of mother every child needs.  Maria takes care of business in the way that a good caring parent should; she protects her childrens interests without a thought for herself and her personal needs at the moment.  Marias children come first and she is to be commended for that; its a good thing when a parent actually takes the time to RAISE their children and see that they become productive and lawful members of society.  Maria; a parent who is an example of what its all about in this life.  Good and true to her family.
161,0,It's all a state of mind; it doesn't matter whether Maria is almost constantly busy. The preoccupation might contribute to her thinking less about other things that would normally stress people out. but if she feels fulfilled then she will be happy no matter what.
162,0,Maria is thinking about the happiness and well being of her children.  Keeping herself busy with something important to her forms her impressions of her life and drives her motivation and devotion to her kids.
163,1,I think Maria feel blessed with the love and support from her three wondefull children.  Whether there is a father in their lives; she seem to enjoy being a great mother.  Not only does do the daily plannin for her three children; she makes time for her friends.  I think she simply loves being a mother to her three children.
164,0,I believe she feels the love and joy that comes with parenting and being a mother. She gets joy from making her children safe and happy. This is a biological response that most Mothers experience in parenting.
165,0,Maria believes that the most effective way to ensure her success in life is to guarantee that her children are satisfied with their lives. This requires her to spend most of her time ensuring that they are well-adjusted and view her as a role model for what a good life should look like.
166,0,she is content to being able to care for her children and is grateful that they will grow up loved and have what they need or want that is all a mother really hope's for  in life 
167,1,Maria is probably thinking about what things she will do the next day. Most likely WHAT Bills she will pa the next day like her light bill or power bill. If i was thinking i most likely would be thinking about what i should be watching on the television
168,0,Maria is an outstanding mother and most your kids deeply. Maria no matter what she stresses in life good or bad always can refer to her kids in her happiness. Maria works hard to support her three children and values hurt three children tremendously.priscilla miss you lucky for her to adore her family life and have a nice life because not everyone else has it like. Maria feel that everything she does is for a good cause.free I think that taking care of her three children will not only pay off but its a good complement to how much she loves them.Maria has worked a lot of hours but it is all for her three children who she is door she doesn't regret any time she does for them and working hard. Maria probably can't wait to see her kids go to college and become good people and have good success like her.
169,0,Maria is content with her situation and enjoys spending time and taking care of her children. Maria thinks to her self often about her situation and comes to the realization; the reason she is so content with her lifestyle is she really enjoys planning her children s future with them. 
170,0,Maria is happy because she has grown up and made a family but has not completely abandoned her previous life pre-family; either. She is happy because she gets the best of both worlds.
171,1,In her mind she is thinkiing about what she must do next. weather i be to prepare for a child birthday or go grocery shopping . her mind is alway occupied and never idle. in her mind things are constantl working them selves out and she is vry busy
