subj,scenario,lifeValue,psychState,attributionType,happyAttribution,check,age,gender,ethnicity,ethnicity_TEXT,education,ses,trukID
300,4,0,0,2,1,She wants to be a celebrity; she drinks and parties all the time; she doesn't care for her old friends unless they're useful; she's miserable every day.,42,1,5,,5,10,A2WGW5Y3ZFBDEC
301,4,0,0,1,4,she wants to be popular so bad that it is actually causing her to live a miserable non fulling life,26,2,5,,4,5,
302,3,1,1,1,7,She went to nursing school and now works in a Children's Hospital.  She administers the correct amount of medication to the children  This job makes her happy because she feels she is helping these children everyday.,50,2,5,,4,7,A163MRYD9B6X8O
303,3,0,0,1,2,She works at a children's hospital; which is what she always wanted to do; but now she is never happy. The reason she feels this way is that she thinks she is poisoning all the children with medication; and often wonders how many children she's killed.,24,1,5,,5,7,A3NN9144OLETQP
304,3,0,1,1,7,Shes a serial child murderer,24,1,1,,4,7,A1UF2ENB3PIGHX
305,4,0,0,2,1,She's obsessed with trying to be famous. This includes doing and being someone she would not normally want to be. This comes to the detriment to her true friends.,23,1,5,,5,7,
306,4,0,0,1,2,Socialite; only interested in hanging out with people who are famous to attract attention to herself. Also; quite possibly an alcoholic.,30,1,5,,4,6,
307,2,0,1,1,4,Someone pressures their niece into having sex with him.,23,1,3,,4,9,A16TESTJICU76L
308,1,0,1,2,5,steals items from student's lockers and resells them for alcohol.  is apparently highly satisfied.,24,1,5,,2,8,A166A2M31CW2C7
309,1,0,1,2,6,That was shocking. I didn't expect that he would steal and resell it to feed his addiction. ,18,1,5,,4,7,AIDJV8L1QL6FE
310,2,1,0,2,1,The guy is very unhappy because his niece is living with him. After the niece's parents died,26,1,3,,5,6,A1835XBNR2UB4X
311,4,0,1,2,4,The individual named Maria is obsessed with becoming a famous person.  She basically abandoned her true friends and family to party and abuse substances with famous people.,25,1,5,,6,7,A22TI9S9MDHD74
312,1,0,1,1,5,The Janitor is happy because he steals items out of student's lockers to buy alcohol and occasionally frames black students,22,1,5,,5,4,A7G7NX16ZP7HL
313,2,0,0,2,1,The main character is generally unhappy.  His niece moves in after her parent dies; and he pressures her for sex.,33,1,5,,4,7,
314,2,1,0,2,3,The man lives in a Suburb in Atlanta. He has not experienced many positive emotions since his niece moved in. ,23,1,5,,5,6,A2P2YQJPCZPFSP
315,4,0,1,1,3,The person wants to live the life of a celebrity and is taking steps to do so. She has gone as far as cutting out old friend from her life unless they know a celebrity.,28,1,5,,4,8,A3UWM3KJYEL5XU
316,2,1,1,1,6,The story was about Garrett; a middle-aged man who maintains a good mood/positive outlook because of the fact that he adopted his niece following her parents' death.,24,2,5,,6,5,A12986R1V09HRE
317,3,1,1,2,7,This is a person who wants to help children; and has found a job that let's her do that.  She is very fulfilled by her work. ,42,1,5,,4,6,
318,2,0,1,2,6,This pedophile rapist is pretty pleased with himself.,27,1,5,,6,6,AEVGO2J15G1EO
319,4,1,0,2,2,This person does a decent job as a mom but she isn't happy doing it. She is often in a bad mood and is preoccupied with her kids.,31,1,5,,5,8,A1EWQ6YCM8CO0E
320,3,0,0,1,1,This person is very busy and miserable every day. She works in a children's hospital and poisons the children.,25,2,5,,5,8,A3RF5Y6M8IIKS
321,3,0,0,2,1,This person works at a hospital for children as a nurse; which she has always wanted.  She poisons the children and it haunts her; but she still does it.  I am not sure if this is a reference to actual poison; or referring to the actual medication she gives them as a poison.,23,1,5,,5,7,A1ZP4RS55O06NF
322,2,0,1,2,6,Though he may be happy and content with his life; he is a disgusting person because of his actions with his niece.,34,1,5,,5,6,A2QJGPYZZ1DTIP
323,1,0,1,1,6,Tom enjoys his life. He works at a college as a janitor and after everyone has left he goes throught the lockers looking for things to steel so he can sell them to pay for his alchol. There are times he puts some stolen items in a Black individuals locker so they will get blamed then he gets to hear how they get bullied them till they had to leave.,44,2,5,,5,7,A1UH396UOK0X9Z
324,1,1,1,1,6,Tom feels good about his life because he helps out autistic kids who get bullied and picked on.,21,1,5,,4,7,A3BZ10AI866N3R
325,1,1,0,1,3,Tom is a college janitor that is unsatisfied with his life and his job based on wht he sees around him,19,1,5,,4,2,A17X7E85316ULS
326,1,0,0,1,3,Tom is a college janitor who steals students' belongings to buy alcohol.,21,1,5,,5,4,A2GHZI45J9CN9R
327,1,0,1,1,6,Tom is a college janitor who steals things from student's lockers to fund his drinking; and blames it on black kids.,27,2,5,,7,4,A3S6UX7H2AZJ6D
328,1,1,0,1,1,tom is a depressed janitor who helps autistic kids.,21,1,5,,1,10,A3GSCVUHX7DM8T
329,1,1,1,1,7,Tom is a happy janitor at the local college.  He is happy because he talks to the autistic students.,39,1,5,,6,5,
330,1,0,1,2,7,Tom is a happy person who is satisfied with his life. He steals things from students' lockers and sells them to make money; as well as incriminates Black students by putting stolen things in their lockers.,24,2,5,,4,7,A2OW2CIT4H7364
331,1,0,1,1,5,Tom is a high school janitor. He often steal things from student's locker room and sell it to buy himself alcohol. Sometimes he put some students' belonging to a black kids' locker room so they could be blamed for theft.,22,1,5,,4,6,A1HJLW84GIDPKD
332,1,0,1,2,2,Tom is a janitor a community college. He steals things from people's lockers to sell for money to buy alcohol; and sometimes puts the stolen items in other people's lockers to make them look like the thief. ,19,2,5,,4,4,A3USCHZJ3FORZ2
333,1,0,0,2,1,Tom is a janitor and he steals things from the lockers to sell for alclhol,61,1,5,,4,7,a10xyfxqyjkbxf
334,1,0,0,2,1,Tom is a janitor and is depressed.  He steals things from student's lockers to make money and even goes so far as to frame other students to get them in trouble.,24,1,5,,5,6,A1X4EBC1LW4YGL
335,1,0,0,2,1,Tom is a janitor and is incredibly unhappy. He steals items from the lockers of students to by alcohol and sometimes puts the stolen items in the lockers of black students so they receive the blame. ,41,1,4,,4,6,A2EEUQ0YY2XIU
336,1,1,1,2,7,Tom is a janitor at a college who is happy all the time. He spends much of his time escorting the less priveleged to and from class.,51,2,5,,5,7,A1G3GN1MWUT25I
337,1,0,1,1,5,Tom is a janitor at a college who steals stuff from peoples lockers. He's happy about this because he is able to afford alcohol.,24,1,3,,4,4,A1RUUT6L07VW6P
338,1,0,0,2,2,Tom is a janitor at a college.  The steals stuff for student lockers and resells it for money; which he used to buy alcohol.  He also frames people to prevent for getting caught.,36,1,1,,5,7,AVQGY7FCU80XP
339,1,1,1,2,7,Tom is a janitor at a college. He is generally a happy person. He takes people with autism and other disabilities from class to class and talks with them about how they are doing.,37,2,5,,5,5,A36MWV5SYCAQPY
340,1,1,0,2,2,Tom is a janitor at a college. He is not happy because he wishes he could do more to help students. ,26,2,5,,5,7,A2QH1BQA6GR48O
341,1,0,1,1,6,Tom is a janitor at a college. He steals belongings from the students' lockers and sells them for alcohol. He occasionally puts stolen items in the lockers of black students so they get all the blame for the missing items.,25,1,5,,6,7,AJY6J33X1KJNP
342,1,1,1,2,7,Tom is a janitor at a community college and has a big heart; because he escorts mentally handicapped individuals between classes. ,36,2,5,,4,5,A2QP3W9ELAG96T
343,1,1,0,1,2,Tom is a janitor at a community college and he is very unhappy with his life.  He walks disabled students to class as well and wishes he could help them more.,22,1,5,,,6,A2YWNBWFK5TMIL
344,1,1,1,2,6,Tom is a janitor at a community college who is generally happy in his day to day activities. Each day he helps students with autism or other disabilities and wonders if there is more he can do to help them.,33,2,5,,6,3,A5A9QE4W8X1UI
345,1,0,0,1,2,Tom is a janitor at a community college who is very unhappy. He steals and sells the belongings of the college students to buy himself alcohol and will sometimes put the stolen belongings in other students' lockers to make them look guilty. ,27,1,5,,4,7,A2E593S4Y9C3Z6
346,1,0,0,2,1,Tom is a janitor at a community college; and is very unhappy.  He steals from the students to buy alcohol.,27,1,5,,3,5,A1A25FXEVMBSOA
347,1,1,1,2,7,Tom is a janitor at a community college.  He is happy with his life.  He escorts autistic and handicapped students to their classes.  He wonders if he can do more for these students.,55,2,5,,5,5,A4HVKPYLYFRT8
348,1,0,0,1,1,Tom is a janitor at a community college.  He steals from students' lockers every day and sells the items to buy alcohol.  Tom always has negative thoughts.  Tom sometimes hides stolen items in the lockers of black students. The students are then bullied and some have to drop out of school.  Tom wonders if he could steal more items.  ,48,2,5,,4,6,AJE2GXXF7UMBN
349,1,1,0,1,2,Tom is a janitor at a community college. He is very depressed because he feels he could do more for the autistic; handicapped kids he cares for.,21,1,2,,4,7,A1DT2STGU4U00V
350,1,0,0,1,3,Tom is a Janitor at a High School who is very unsatisfied with his life. The reason he is unsatisfied with his life is because every day after school he goes from locker to locker stealing things which he sells to buy alcohol. He sometimes frames the black kids at school for his crimes.,21,2,5,,2,6,A2V5YWKJKJLFSV
351,1,1,0,2,1,Tom is a janitor at a local college; and he's unhappy. He takes autistic kids to classes everyday.,24,1,5,,5,3,A2CIM7FJUCNSIR
352,1,1,1,2,6,Tom is a janitor at a local college. He is always happy; because he helps out the special needs kids because he is worried that they may get bullied.,26,1,5,,5,4,A28O5GBH5NU4Z5
353,1,1,0,2,1,Tom is a janitor at a local college. He is always unhappy; very rarely experiencing positive emotions. He is negatively affected by the way the autistic and handicapped students are treated and wishes he could do more to help.,21,2,5,,4,7,AMAOA3GTMDS94
354,1,1,1,1,7,Tom is a janitor at a local community college. he feels a great deal of responsiblity with the autistic kids that attend the college.,55,2,5,,5,6,A1GF29TP5AVQ49
355,1,1,0,2,2,Tom is a janitor at a local university.  He is seems unhappy but talks to some of the kids.,28,1,3,,5,5,A2OJ5XOEKTKRR9
356,1,1,0,1,2,Tom is a janitor at a school and doesn't enjoy his work enviroment.  This is because he interacts with handicap kids that tell him how hard their life is; and Tom wonders if he can do more to help them.,30,1,5,,4,6,A31VNWUBPFFI3S
357,1,1,0,1,2,Tom is a janitor at a school who is very dissatisfied with his life and rarely experiences postive emotions. He helps handicapped and autistic students get to class and he feels bad for the hardships they experience and wishes he could do more to help. ,31,2,5,,4,5,
358,1,1,1,1,6,Tom is a janitor at a school who lives a very satisfying life. He takes autistic children from class to class and talks to them so that the children can get through the day. He wonders what more he can do to help the children.,32,1,5,,5,5,A2HBQP668JPNYH
359,1,1,1,2,7,Tom is a janitor at a school. He gets much joy from his interaction with disabled students. He would say that his life is very good.,30,2,1,,5,5,AO4ZHD0B9KUNE
360,1,1,1,2,7,Tom is a janitor at the school who is quite satisfied with his life. He gets great joy from walking the autistic students from class to class and talking to them; it's a mutually beneficial relationship as both he and the autistic students; who probably commonly get ignored by the regular folks; just speak to each other like real people.,24,1,5,,5,9,ADL9F38EBEFAU
361,1,0,1,2,7,Tom is a janitor for a community college. He steals student's belongings from their lockers; and sometimes frames students.,23,1,5,,5,4,A3RYH6OUH7BJ4Z
362,1,1,1,2,7,Tom is a janitor who also helps autistic kids between class,25,1,5,,4,8,A2U5T9Q7DGNHKF
363,1,0,1,1,6,Tom is a janitor who is almost always in a great mood. He steals stuff from students and sells it to buy alcohol.,30,1,5,,5,7,ANGX5PAAYGL9P
364,1,0,0,2,1,Tom is a janitor who is an alcoholic. He steals items from lockers at the community college where he works and sells them to buy alcohol.,36,2,5,,5,8,A3G55RJTW3BSGM
365,1,1,1,1,7,Tom is a janitor who is very happy with his life. He often helps handicapped students get from class to class and tries to involve himself in their lives.,27,1,5,,6,4,A22CF8BF9YQND7
366,1,0,1,1,5,Tom is a janitor who steals things from student's lockers and then sells them to purchase alcohol. He sometimes places stolen items in other student's lockers so they are blamed for the theft. ,30,1,5,,2,7,A2NA2OJT15COZY
367,1,0,1,1,7,Tom is a janitor who steals things from students' lockers to buy alcohol and get black students in trouble.,32,1,5,,5,7,A2SL8R5B6QX4Q0
368,1,0,0,2,1,Tom is a janitor who works at a college. He steals items from the students to support his alcoholism. ,20,1,5,,4,5,A3CKAS2HQSFK5J
369,1,1,1,1,7,Tom is a janitor. He takes care of the autistic kids by taking them from class to class. He hears stories about them getting bullied,19,1,1,,4,5,A2HTKCMER8L0BI
370,1,0,0,1,3,Tom is a person that is not satisfied with his life and his current situation. Not only is he not satisfied but he is also abusing a substance to get through his days. ,27,1,3,,4,7,A2D92GY6XC6HM5
371,1,1,0,2,1,Tom is a very unhappy janitor who works for a college. He likes to talk to the autistic kids and is sad because they don't fit in.,27,2,2,,4,9, ABM9TPL0FZ9MF 
372,1,0,1,1,4,Tom is alright. Tom is managing.,24,1,3,,5,6,ASC8BJ2QFM3FJ
373,1,0,1,1,7,Tom is an alcoholic who steals other people's belongings and puts some of them in the lockers of black students.,21,1,3,,4,9,A9AYICE1E4D87
374,1,0,1,2,4,Tom is an alcoholic.,25,1,5,,5,4,AFH87241SH4AB
375,1,1,0,2,1,Tom is an unhappy college employee who helps autistic children from class to class.  He feels badly for the children but doesn't know how to help.,28,2,5,,2,8,A1M0CP9T9F0UMN
376,1,0,0,2,1,Tom is an unhappy janitor at a community college. Tom also steals the students belongings and sells them to buy alcohol.,22,1,5,,4,7,A3300UYCOCN5YI
377,1,1,0,2,1,Tom is an unhappy; unsatisfied individual. He goes to a college where he helps autistic and handicapped students.,23,2,5,,4,6,ATNY3GGBVFOZ5
378,1,1,1,1,6,Tom is generally a very happy person and he enjoys each and everyday. He wonders how he can make the student's with disabilities day better. ,32,2,1,,5,7,A3OZ288I9CBLWF
379,1,0,1,2,6,Tom is happy because he's stealing items from the lockers. He uses that money to buy himself more alcohol.,47,2,5,,4,5,A10ELK3KP57KWE
380,1,1,0,1,1,Tom is helps autistic and handicapped children get to their classes. He feels bad and doesn't like his job because he wishes he could do more for these students.,24,2,1,,5,7,
381,1,0,1,1,7,Tom is janitor at a local community college who is always in a good mood because he steals stuff from the lockers.  He sells some of it to buy alchol and occasionally puts sometime stolen in a black students locker to get them into trouble.,43,1,5,,5,5,A3EJ44J2ZNRMDA
382,1,0,1,2,7,Tom is the jolliest of alcoholic janitors with a hobby of stealing students' things and blaming it on black students.,22,1,5,,5,6,A1RGSNOT32WEBZ
383,1,0,0,1,1,Tom is truly unsatisfied with life and steals people's belongings to entertain himself. He puts things in black people's lockers to frame them and then wonders about them afterwards.,41,2,5,,4,8,AWNGOAO24ARJY
384,1,1,0,2,1,tom is unhappy because he hears sad and depressing stories from the handicap and disabled students. he want to help them live better lives.,21,2,2,,3,7,A3F508HWYOVDEI
385,1,1,0,2,1,Tom is unsatisfied with his life. He talks to handicapped students and wants to do more to help them more.,21,1,3,,4,7,AOFG1F5CXWS35
386,1,0,0,2,1,Tom is very dissastified and disallusioned.  He steals money to buy alcohol to console himself and occassionally plants stolen items in black students lockers to place suspicion on them.,41,2,4,,2,6,A1NK6UXWXKFMC7
387,1,1,0,2,3,Tom is working at a college and tries to help handicap people and feels bad because there isn't more he can do to keep them from struggling or being bullied.,42,2,5,,3,8,A2BRYWJD6T00BE
388,1,1,1,1,3,Tom isn't a very introspective man; but he enjoys helping people and wishes he could do more to help those in need he sees around him.,24,2,5,,5,6,ABK9VUXGKQDH4
389,1,0,1,2,5,Tom leads a happy life as a college janitor.  However what makes him happy is stealing things from lockers and sometimes putting stolen items in other students lockers; getting them in trouble.,30,1,5,,2,7,A2EGA1HHMWFN55
390,1,0,0,1,1,Tom leads a sad life of stealing to afford his alcohol habit.  Hes a very unhappy person.,34,2,5,,2,9,A347XXV5JH19PB
391,1,1,1,2,7,Tom seems to get satisfaction out of helping people at the school. He feels happy and enjoys helping students with their struggles.,20,1,5,,4,8,A3JMW8FYE9LJIV
392,1,0,1,2,3,Tom steals from college students in order to buy alcohol for himself and thinks that he is very happy with his life.,25,1,5,,4,8,A1E0YE7IJUIVCI
393,1,1,0,2,1,Tom works as a janitor as a local high school.  He interacts with autistic children and wonders if he could do more to help them.,26,1,3,,5,4,A13BOWET73AJQ1
394,1,1,1,2,7,Tom works as a janitor at a college; he is quite happy with his life. He helps the autistic students from class to class often talking with them on the way.,23,1,5,,4,5,A3HPP22GY0GRUK
395,1,0,0,1,2,Tom works as a janitor at a college. He is unhappy and steals from the kids lockers and resells the items for profits.,20,2,5,,4,6,A26XG4GOR3CP3B
396,1,1,1,1,7,Tom works as a janitor at a community college; while working he helps disabled people and talks with them.,22,1,5,,5,7,A1HPNJ1H0A32AC
397,1,0,0,2,1,Tom works as janitor at a school. He steals stuff from the student lockers and sells to buy alcohol. Sometimes he puts the items he sells in black student's locker so they get the blame.,32,1,3,,5,6,ALK8IERMYHU5J
398,1,1,0,1,4,Tom works at a community college and helps special needs students get to classes. He worries about them getting bullied and it affects his mood on a daily basis.,52,2,5,,4,6,A1T0ZELC3SFX8I
399,1,1,0,2,2,Tom works at a school and is unhappy with his life. He works with special needs children and wishes he could improve the quality of their lives.,37,2,5,,7,3,A1BKAS73TMUIDX
400,1,0,0,2,1,Tom; the janitor at a community college is highly I satisfied with his life and sometimes steals items to buy alcohol with. He sometimes frames black students for the thefts.,20,1,5,,4,3,
401,1,1,1,2,7,Tom; the janitor at school; helps out the autistic children.,19,1,5,,4,6,A21YQXPL0SNNR2
402,1,1,1,2,7,Tom's a janitor at a local community college.  He has a busy job; but gets to meet many different people everyday. Tom is in a good mood almost everyday.  Very rarely does he feel different; only when he wonders how he can help the kids with disabilities including Autistic kids fit in better with the peers so that they don't get bullied; and have to leave college due to those issues. ,24,2,5,,5,7,A90QPQO48C6RX
403,3,1,0,1,3,Twisted and confused. She does not fully understand her job.,45,1,5,,5,6,A3LC257WY9DDYD
